J,"Neyem, A; González, LA; Mendoza, M; Alcocer, JPS; Centellas, L; Paredes, C",,,,"Neyem, Andres; Gonzalez, Luis A.; Mendoza, Marcelo; Alcocer, Juan Pablo Sandoval; Centellas, Leonardo; Paredes, Carlos",,,Toward an AI Knowledge Assistant for Context-Aware Learning Experiences in Software Capstone Project Development,IEEE TRANSACTIONS ON LEARNING TECHNOLOGIES,,,,,,,,,,,,"Software assistants have significantly impacted software development for both practitioners and students, particularly in capstone projects. The effectiveness of these tools varies based on their knowledge sources; assistants with localized domain-specific knowledge may have limitations, while tools, such as ChatGPT, using broad datasets, might offer recommendations that do not always match the specific objectives of a capstone course. Addressing a gap in current educational technology, this article introduces an AI Knowledge Assistant specifically designed to overcome the limitations of the existing tools by enhancing the quality and relevance of large language models (LLMs). It achieves this through the innovative integration of contextual knowledge from a local lessons learned database tailored to the capstone course. We conducted a study with 150 students using the assistant during their capstone course. Integrated into the Kanban project tracking system, the assistant offered recommendations using different strategies: direct searches in the lessons learned database, direct queries to a generative pretrained transformers (GPT) model, query enrichment with lessons learned before submission to GPT and large language model meta AI (LLaMa) models, and query enhancement with Stack Overflow data before GPT processing. Survey results underscored a strong preference among students for direct LLM queries and those enriched with local repository insights, highlighting the assistant's practical value. Furthermore, our linguistic analysis conclusively demonstrated that texts generated by the LLM closely mirrored the linguistic standards and topical relevance of university course requirements. This alignment not only fosters a deeper understanding of course content but also significantly enhances the material's applicability to real-world scenarios.",,,,,"Sandoval Alcocer, Juan Pablo/CAA-0465-2022","Sandoval Alcocer, Juan Pablo/0000-0002-8335-4351",,,,,,,,,,,,,1939-1382,,,,,,2024,17,,,,,,1639,1654,,10.1109/TLT.2024.3396735,http://dx.doi.org/10.1109/TLT.2024.3396735,,,,,,,,,,,,,WOS:001235546700003,View Full Record in Web of Science
C,"Hellas, A; Leinonen, J; Sarsa, S; Koutcheme, C; Kujanpää, L; Sorva, J",,,ACM,"Hellas, Arto; Leinonen, Juho; Sarsa, Sami; Koutcheme, Charles; Kujanpaa, Lilja; Sorva, Juha",,,Exploring the Responses of Large Language Models to Beginner Programmers' Help Requests,"PROCEEDINGS OF THE 2023 ACM CONFERENCE ON INTERNATIONAL COMPUTING EDUCATION RESEARCH V.1, ICER 2023 V1",,,,,19th Annual ACM Conference on International Computing Education Research V.1 (ICER),"AUG 07-11, 2023","Chicago, IL","Assoc Comp Machinery,ACM Special Interest Grp Comp Sci Educ",,,,"Background and Context: Over the past year, large language models (LLMs) have taken the world by storm. In computing education, like in other walks of life, many opportunities and threats have emerged as a consequence. Objectives: In this article, we explore such opportunities and threats in a specific area: responding to student programmers' help requests. More specifically, we assess how good LLMs are at identifying issues in problematic code that students request help on. Method: We collected a sample of help requests and code from an online programming course. We then prompted two different LLMs (OpenAI Codex and GPT-3.5) to identify and explain the issues in the students' code and assessed the LLM-generated answers both quantitatively and qualitatively. Findings: GPT-3.5 outperforms Codex in most respects. Both LLMs frequently find at least one actual issue in each student program (GPT-3.5 in 90% of the cases). Neither LLM excels at finding all the issues (GPT-3.5 finding them 57% of the time). False positives are common (40% chance for GPT-3.5). The advice that the LLMs provide on the issues is often sensible. The LLMs perform better on issues involving program logic rather than on output formatting. Model solutions are frequently provided even when the LLM is prompted not to. LLM responses to prompts in a non-English language are only slightly worse than responses to English prompts. Implications: Our results continue to highlight the utility of LLMs in programming education. At the same time, the results highlight the unreliability of LLMs: LLMs make some of the same mistakes that students do, perhaps especially when formatting output as required by automated assessment systems. Our study informs teachers interested in using LLMs as well as future efforts to customize LLMs for the needs of programming education.",,,,,"Leinonen, Juho/D-2162-2018","Leinonen, Juho/0000-0001-6829-9449; Koutcheme, Charles/0000-0002-2272-2763",,,,,,,,,,,,,,,978-1-4503-9976-0,,,,2023,,,,,,,93,105,,10.1145/3568813.3600139,http://dx.doi.org/10.1145/3568813.3600139,,,,,,,,,,,,,WOS:001141973500007,View Full Record in Web of Science
C,"Lau, S; Guo, PJ",,,ACM,"Lau, Sam; Guo, Philip J.",,,From Ban It TillWe Understand It to Resistance is Futile: How University Programming Instructors Plan to Adapt as More Students Use AI Code Generation and Explanation Tools such as ChatGPT and GitHub Copilot,"PROCEEDINGS OF THE 2023 ACM CONFERENCE ON INTERNATIONAL COMPUTING EDUCATION RESEARCH V.1, ICER 2023 V1",,,,,19th Annual ACM Conference on International Computing Education Research V.1 (ICER),"AUG 07-11, 2023","Chicago, IL","Assoc Comp Machinery,ACM Special Interest Grp Comp Sci Educ",,,,"Over the past year (2022-2023), recently-released AI tools such as ChatGPT and GitHub Copilot have gained significant attention from computing educators. Both researchers and practitioners have discovered that these tools can generate correct solutions to a variety of introductory programming assignments and accurately explain the contents of code. Given their current capabilities and likely advances in the coming years, how do university instructors plan to adapt their courses to ensure that students still learn well? To gather a diverse sample of perspectives, we interviewed 20 introductory programming instructors (9 women + 11 men) across 9 countries (Australia, Botswana, Canada, Chile, China, Rwanda, Spain, Switzerland, United States) spanning all 6 populated continents. To our knowledge, this is the first empirical study to gather instructor perspectives about how they plan to adapt to these AI coding tools that more students will likely have access to in the future. We found that, in the short-term, many planned to take immediate measures to discourage AI-assisted cheating. Then opinions diverged about how to work with AI coding tools longer-term, with one side wanting to ban them and continue teaching programming fundamentals, and the other side wanting to integrate them into courses to prepare students for future jobs. Our study findings capture a rare snapshot in time in early 2023 as computing instructors are just starting to form opinions about this fast-growing phenomenon but have not yet converged to any consensus about best practices. Using these findings as inspiration, we synthesized a diverse set of open research questions regarding how to develop, deploy, and evaluate AI coding tools for computing education.",,,,,,"Lau, Sam/0000-0002-3160-0151",,,,,,,,,,,,,,,978-1-4503-9976-0,,,,2023,,,,,,,106,121,,10.1145/3568813.3600138,http://dx.doi.org/10.1145/3568813.3600138,,,,,,,,,,,,,WOS:001141973500008,View Full Record in Web of Science
C,"Feng, YH; Vanam, S; Cherukupally, M; Zheng, WJ; Qiu, MK; Chen, HH",,"Shahriar, H; Teranishi, Y; Cuzzocrea, A; Sharmin, M; Towey, D; Majumder, AKMJA; Kashiwazaki, H; Yang, JJ; Takemoto, M; Sakib, N; Banno, R; Ahamed, SI",,"Feng, Yunhe; Vanam, Sreecharan; Cherukupally, Manasa; Zheng, Weijian; Qiu, Meikang; Chen, Haihua",,,Investigating Code Generation Performance of ChatGPT with Crowdsourcing Social Data,"2023 IEEE 47TH ANNUAL COMPUTERS, SOFTWARE, AND APPLICATIONS CONFERENCE, COMPSAC",Proceedings International Computer Software and Applications Conference,,,,"47th IEEE-Computer-Society Annual International Conference on Computers, Software, and Applications (COMPSAC)","JUN 27-29, 2023","Univ Torino, Torino, ITALY","IEEE,IEEE Comp Soc",Univ Torino,,,"The recent advancements in Artificial Intelligence, particularly in large language models and generative models, are reshaping the field of software engineering by enabling innovative ways of performing various tasks, such as programming, debugging, and testing. However, few existing works have thoroughly explored the potential of AI in code generation and users' attitudes toward AI-assisted coding tools. This knowledge gap leaves it unclear how AI is transforming software engineering and programming education. This paper presents a scalable crowdsourcing data-driven framework to investigate the code generation performance of generative large language models from diverse perspectives across multiple social media platforms. Specifically, we utilize ChatGPT, a popular generative large language model, as a representative example to reveal its insights and patterns in code generation. First, we propose a hybrid keyword word expansion method that integrates words suggested by topic modeling and expert knowledge to filter relevant social posts of interest on Twitter and Reddit. Then we collect 316K tweets and 3.2K Reddit posts about ChatGPT's code generation, spanning from Dec. 1, 2022 to January 31, 2023. Our data analytics show that ChatGPT has been used in more than 10 programming languages, with Python and JavaScript being the two most popular, for a diverse range of tasks such as code debugging, interview preparation, and academic assignment solving. Surprisingly, our analysis shows that fear is the dominant emotion associated with ChatGPT's code generation, overshadowing emotions of happiness, anger, surprise, and sadness. Furthermore, we construct a ChatGPT prompt and corresponding code dataset by analyzing the screen-shots of ChatGPT code generation shared on social media. This dataset enables us to evaluate the quality of the generated code, and we have released this dataset to the public. We believe the insights gained from our work will provide valuable guidance for future research on AI-powered code generation.",,,,,"Feng, Yunhe/AAB-8342-2019","Feng, Yunhe/0000-0001-6577-227X; Chen, Haihua/0000-0002-7088-9752",,,,,,,,,,,,,0730-3157,,979-8-3503-2697-0,,,,2023,,,,,,,876,885,,10.1109/COMPSAC57700.2023.00117,http://dx.doi.org/10.1109/COMPSAC57700.2023.00117,,,,,,,,,,,,,WOS:001046484100107,View Full Record in Web of Science
J,"Thida, M",,,,"Thida, Myo",,,Automated Analysis of Job Market Demands using Large Language Model,INTERNATIONAL JOURNAL OF ADVANCED COMPUTER SCIENCE AND APPLICATIONS,,,,,,,,,,,,"This paper presents a comprehensive analysis of labor market demands for Myanmar workers in Japan, and Thailand, focusing on opportunities for individuals without higher education degrees. Leveraging ChatGPT's text classification and summarization capabilities, we extracted vital insights from extensive job advertisements and social media groups. The dataset comprises 152 job advertisements from Thailand and 30 from Japan, collected in 2023. Our research provides a valuable snapshot of skill demands and job opportunities, offering insights for informed decision-making by both job seekers and international non-governmental organizations. The innovative approach of using ChatGPT highlights its efficacy in understanding labor market dynamics. These findings serve as a foundation for tailored interventions to bridge employment challenges faced by marginalized Myanmar youths.",,,,,"thida, myo/O-6173-2018",,,,,,,,,,,,,,2158-107X,2156-5570,,,,AUG,2023,14,8,,,,,937,946,,,,,,,,,,,,,,,,WOS:001064929600001,View Full Record in Web of Science
J,"Tsai, ML; Ong, CW; Chen, CL",,,,"Tsai, Meng -Lin; Ong, Chong Wei; Chen, Cheng-Liang",,,Exploring the use of large language models (LLMs) in chemical engineering education: Building core course problem models with Chat-GPT,EDUCATION FOR CHEMICAL ENGINEERS,,,,,,,,,,,,"This study highlights the potential benefits of integrating Large Language Models (LLMs) into chemical engineering education. In this study, Chat-GPT, a user-friendly LLM, is used as a problem-solving tool. Chemical engineering education has traditionally focused on fundamental knowledge in the classroom with limited opportunities for hands-on problem-solving. To address this issue, our study proposes an LLMs-assisted problemsolving procedure. This approach promotes critical thinking, enhances problem-solving abilities, and facilitates a deeper understanding of core subjects. Furthermore, incorporating programming into chemical engineering education prepares students with vital Industry 4.0 skills for contemporary industrial practices. During our experimental lecture, we introduced a simple example of building a model to calculate steam turbine cycle efficiency, and assigned projects to students for exploring the possible use of LLMs in solving various aspect of chemical engineering problems. Although it received mixed feedback from students, it was found to be an accessible and practical tool for improving problem-solving efficiency. Analyzing the student projects, we identified five common difficulties and misconceptions and provided helpful suggestions for overcoming them. Our course has limitations regarding using advanced tools and addressing complex problems. We further provide two additional examples to better demonstrate how to integrate LLMs into core courses. We emphasize the importance of universities, professors, and students actively embracing and utilizing LLMs as tools for chemical engineering education. Students must develop critical thinking skills and a thorough understanding of the principles behind LLMs, taking responsibility for their use and creations. This study provides valuable insights for enhancing chemical engineering education's learning experience and outcomes by integrating LLMs.",,,,,,"Tsai, Meng-Lin/0009-0008-9861-1139; Ong, Chong Wei/0000-0002-0189-1189",,,,,,,,,,,,,,1749-7728,,,,JUL,2023,44,,,,,,71,95,,10.1016/j.ece.2023.05.001,http://dx.doi.org/10.1016/j.ece.2023.05.001,,MAY 2023,,,,,,,,,,,WOS:001054652000001,View Full Record in Web of Science
J,"French, F; Levi, D; Maczo, C; Simonaityte, A; Triantafyllidis, S; Varda, G",,,,"French, Fiona; Levi, David; Maczo, Csaba; Simonaityte, Aiste; Triantafyllidis, Stefanos; Varda, Gergo",,,Creative Use of OpenAI in Education: Case Studies from Game Development,MULTIMODAL TECHNOLOGIES AND INTERACTION,,,,,,,,,,,,"Educators and students have shown significant interest in the potential for generative artificial intelligence (AI) technologies to support student learning outcomes, for example, by offering personalized experiences, 24 h conversational assistance, text editing and help with problem-solving. We review contemporary perspectives on the value of AI as a tool in an educational context and describe our recent research with undergraduate students, discussing why and how we integrated OpenAI tools ChatGPT and Dall-E into the curriculum during the 2022-2023 academic year. A small cohort of games programming students in the School of Computing and Digital Media at London Metropolitan University was given a research and development assignment that explicitly required them to engage with OpenAI. They were tasked with evaluating OpenAI tools in the context of game development, demonstrating a working solution and reporting on their findings. We present five case studies that showcase some of the outputs from the students and we discuss their work. This mode of assessment was both productive and popular, mapping to students' interests and helping to refine their skills in programming, problem-solving, critical reflection and exploratory design.",,,,,,"French, Fiona/0000-0003-4226-6889",,,,,,,,,,,,,,2414-4088,,,,AUG,2023,7,8,,,,,,,81,10.3390/mti7080081,http://dx.doi.org/10.3390/mti7080081,,,,,,,,,,,,,WOS:001056644500001,View Full Record in Web of Science
C,"MacNeil, S; Denny, P; Tran, A; Leinonen, J; Bernstein, S; Hellas, A; Sarsa, S; Kim, J",,,ACM,"MacNeil, Stephen; Denny, Paul; Tran, Andrew; Leinonen, Juho; Bernstein, Seth; Hellas, Arto; Sarsa, Sami; Kim, Joanne",,,Decoding Logic Errors: A Comparative Study on Bug Detection by Students and Large Language Models,"PROCEEDINGS OF THE 26TH AUSTRALASIAN COMPUTING EDUCATION CONFERENCE, ACE 2024",,,,,26th Australasian Computing Education Conference (ACE),"JAN 29-FEB 02, 2024","Sydney, AUSTRALIA",,,,,"Identifying and resolving logic errors can be one of the most frustrating challenges for novices programmers. Unlike syntax errors, for which a compiler or interpreter can issue a message, logic errors can be subtle. In certain conditions, buggy code may even exhibit correct behavior - in other cases, the issue might be about how a problem statement has been interpreted. Such errors can be hard to spot when reading the code, and they can also at times be missed by automated tests. There is great educational potential in automatically detecting logic errors, especially when paired with suitable feedback for novices. Large language models (LLMs) have recently demonstrated surprising performance for a range of computing tasks, including generating and explaining code. These capabilities are closely linked to code syntax, which aligns with the next token prediction behavior of LLMs. On the other hand, logic errors relate to the runtime performance of code and thus may not be as well suited to analysis by LLMs. To explore this, we investigate the performance of two popular LLMs, GPT-3 and GPT-4, for detecting and providing a novice-friendly explanation of logic errors. We compare LLM performance with a large cohort of introductory computing students (.. = 964) solving the same error detection task. Through a mixed-methods analysis of student and model responses, we observe significant improvement in logic error identification between the previous and current generation of LLMs, and find that both LLM generations significantly outperform students. We outline how such models could be integrated into computing education tools, and discuss their potential for supporting students when learning programming.",,,,,"MacNeil, Stephen/HPH-0843-2023; Leinonen, Juho/D-2162-2018","MacNeil, Stephen/0000-0003-2781-6619; Leinonen, Juho/0000-0001-6829-9449",,,,,,,,,,,,,,,979-8-4007-1619-5,,,,2024,,,,,,,11,18,,10.1145/3636243.3636245,http://dx.doi.org/10.1145/3636243.3636245,,,,,,,,,,,,,WOS:001166861800002,View Full Record in Web of Science
J,"Zhang, JL; Cambronero, JP; Gulwani, S; Le, V; Piskac, R; Soares, G; Verbruggen, G",,,,"Zhang, Jialu; Cambronero, Jose Pablo; Gulwani, Sumit; Le, Vu; Piskac, Ruzica; Soares, Gustavo; Verbruggen, Gust",,,PyDex: Repairing Bugs in Introductory Python Assignments using LLMs,PROCEEDINGS OF THE ACM ON PROGRAMMING LANGUAGES-PACMPL,,,,,,,,,,,,"Students often make mistakes in their introductory programming assignments as part of their learning process. Unfortunately, providing custom repairs for these mistakes can require a substantial amount of time and effort from class instructors. Automated program repair (APR) techniques can be used to synthesize such fixes. Prior work has explored the use of symbolic and neural techniques for APR in the education domain. Both types of approaches require either substantial engineering efforts or large amounts of data and training. We propose to use a large language model trained on code, such as Codex (a version of GPT), to build an APR system - PyDex - for introductory Python programming assignments. Our system can fix both syntactic and semantic mistakes by combining multi-modal prompts, iterative querying, test-case-based selection of few-shots, and program chunking. We evaluate PyDex on 286 real student programs and compare to three baselines, including one that combines a state-of-the-art Python syntax repair engine, BIFI, and a state-of-the-art Python semantic repair engine for student assignments, Refactory. We find that PyDex can fix more programs and produce smaller patches on average.",,,,,,"Gulwani, Sumit/0000-0002-9226-9634",,,,,,,,,,,,,,2475-1421,,,,APR,2024,8,OOPSLA,,,,,,,133,10.1145/3649850,http://dx.doi.org/10.1145/3649850,,,,,,,,,,,,,WOS:001209927600040,View Full Record in Web of Science
J,"Barambones, J; Moral, C; de Antonio, A; Imbert, R; Martínez-Normand, L; Villalba-Mora, E",,,,"Barambones, Jose; Moral, Cristian; de Antonio, Angelica; Imbert, Ricardo; Martinez-Normand, Loic; Villalba-Mora, Elena",,,ChatGPT for Learning HCI Techniques: A Case Study on Interviews for Personas,IEEE TRANSACTIONS ON LEARNING TECHNOLOGIES,,,,,,,,,,,,"Before interacting with real users, developers must be proficient in human-computer interaction (HCI) so as not to exhaust user patience and availability. For that, substantial training and practice are required, but it is costly to create a variety of high-quality HCI training materials. In this context, chat generative pretrained transformer (ChatGPT) and other chatbots based on large language models (LLMs) offer an opportunity to generate training materials of acceptable quality without foregoing specific human characteristics present in real-world scenarios. Personas is a user-centered design method that encompasses fictitious but believable user archetypes to help designers understand and empathize with their target audience during product design. We conducted an exploratory study on the Personas technique, addressing the validity and believability of interviews designed by HCI trainers and answered by ChatGPT-simulated users, which can be used as training material for persona creation. Specifically, we employed ChatGPT to respond to interviews designed by user experience (UX) experts. Two groups, HCI professors and professionals, then evaluated the validity of the generated materials considering quality, usefulness, UX, and ethics. The results show that both groups rated the interviews as believable and helpful for Personas training. However, some concerns about response repetition and low response variability suggested the need for further research on improved prompt design in order to generate more diverse and well-developed responses. The findings of this study provide insight into how HCI trainers can use ChatGPT to help their students master persona creation skills before working with real users in real-world scenarios for the first time.",,,,,"Villalba Mora, Elena/AAS-7030-2020; Imbert, Ricardo/M-1268-2014","Villalba Mora, Elena/0000-0001-6043-6322; Barambones, Jose/0000-0003-3860-7257; Imbert, Ricardo/0000-0002-7738-4941",,,,,,,,,,,,,1939-1382,,,,,,2024,17,,,,,,1486,1501,,10.1109/TLT.2024.3386095,http://dx.doi.org/10.1109/TLT.2024.3386095,,,,,,,,,,,,,WOS:001214521800004,View Full Record in Web of Science
C,"Leinonen, J; Denny, P; MacNeil, S; Sarsa, S; Bernstein, S; Kim, J; Tran, A; Hellas, A",,,ACM,"Leinonen, Juho; Denny, Paul; MacNeil, Stephen; Sarsa, Sami; Bernstein, Seth; Kim, Joanne; Tran, Andrew; Hellas, Arto",,,Comparing Code Explanations Created by Students and Large Language Models,"PROCEEDINGS OF THE 2023 CONFERENCE ON INNOVATION AND TECHNOLOGY IN COMPUTER SCIENCE EDUCATION, ITICSE 2023, VOL 1",,,,,28th Annual Conference on Innovation and Technology in Computer Science Education (ITiCSE),"JUL 08-12, 2023","Univ Turku, Turku, FINLAND","Assoc Comp Machinery,ACM Special Interest Grp Comp Sci Educ,ACM Europe Council,Informat Europe",Univ Turku,,,"Reasoning about code and explaining its purpose are fundamental skills for computer scientists. There has been extensive research in the field of computing education on the relationship between a student's ability to explain code and other skills such as writing and tracing code. In particular, the ability to describe at a high-level of abstraction how code will behave over all possible inputs correlates strongly with code writing skills. However, developing the expertise to comprehend and explain code accurately and succinctly is a challenge for many students. Existing pedagogical approaches that scaffold the ability to explain code, such as producing exemplar code explanations on demand, do not currently scale well to large classrooms. The recent emergence of powerful large language models (LLMs) may offer a solution. In this paper, we explore the potential of LLMs in generating explanations that can serve as examples to scaffold students' ability to understand and explain code. To evaluate LLM-created explanations, we compare them with explanations created by students in a large course (n approximate to 1000) with respect to accuracy, understandability and length. We find that LLM-created explanations, which can be produced automatically on demand, are rated as being significantly easier to understand and more accurate summaries of code than student-created explanations. We discuss the significance of this finding, and suggest how such models can be incorporated into introductory programming education.",,,,,"Leinonen, Juho/D-2162-2018; MacNeil, Stephen/HPH-0843-2023","Leinonen, Juho/0000-0001-6829-9449; MacNeil, Stephen/0000-0003-2781-6619; Denny, Paul/0000-0002-5150-9806",,,,,,,,,,,,,,,979-8-4007-0138-2,,,,2023,,,,,,,124,130,,10.1145/3587102.3588785,http://dx.doi.org/10.1145/3587102.3588785,,,,,,,,,,,,,WOS:001051691300020,View Full Record in Web of Science
