J,"Kwon, S; Lee, S; Kim, T; Ryu, D; Baik, J",,,,"Kwon, Sunjae; Lee, Sungu; Kim, Taehyoun; Ryu, Duksan; Baik, Jongmoon",,,Exploring LLM-based Automated Repairing of Ansible Script in Edge-Cloud Infrastructures,JOURNAL OF WEB ENGINEERING,,,,,3rd International workshop on Big Data-Driven Edge Cloud Services (BECS),"JUN 06-09, 2023","Alicante, SPAIN",,,,,"Edge-Cloud system requires massive infrastructures located in closer to the user to minimize latencies in handling Big data. Ansible is one of the most popular Infrastructure as Code (IaC) tools crucial for deploying these infrastructures of the Edge-cloud system. However, Ansible also consists of code, and its code quality is critical in ensuring the delivery of high-quality services within the Edge-Cloud system. On the other hand, the Large Langue Model (LLM) has performed remarkably on various Software Engineering (SE) tasks in recent years. One such task is Automated Program Repairing (APR), where LLMs assist developers in proposing code fixes for identified bugs. Nevertheless, prior studies in LLM-based APR have predominantly concentrated on widely used programming languages (PL), such as Java and C, and there has yet to be an attempt to apply it to Ansible. Hence, we explore the applicability of LLM-based APR on Ansible. We assess LLMs' performance (ChatGPT and Bard) on 58 Ansible script revision cases from Open Source Software (OSS). Our findings reveal promising prospects, with LLMs generating helpful responses in 70% of the sampled cases. Nonetheless, further research is necessary to harness this approach's potential fully.",,,,,,,,,,,,,,,,,,,1540-9589,1544-5976,,,,,2023,22,6,,,,,889,912,,10.13052/jwe1540-9589.2263,http://dx.doi.org/10.13052/jwe1540-9589.2263,,,,,,,,,,,,,WOS:001167543200004,View Full Record in Web of Science
C,"Becker, BA; Denny, P; Finnie-Ansley, J; Luxton-Reilly, A; Prather, J; Santos, EA",,,ACM,"Becker, Brett A.; Denny, Paul; Finnie-Ansley, James; Luxton-Reilly, Andrew; Prather, James; Santos, Eddie Antonio",,,Programming Is Hard - Or at Least It Used to Be: Educational Opportunities and Challenges of AI Code Generation,"PROCEEDINGS OF THE 54TH ACM TECHNICAL SYMPOSIUM ON COMPUTER SCIENCE EDUCATION, VOL 1, SIGCSE 2023",,,,,54th Annual ACM SIGCSE Technical Symposium on Computer Science Education (SIGCSE TS),"MAR 15-18, 2023","Toronto, CANADA","Assoc Comp Machinery,ACM Special Interest Grp Comp Sci Educ",,,,"The introductory programming sequence has been the focus of much research in computing education. The recent advent of several viable and freely-available AI-driven code generation tools present several immediate opportunities and challenges in this domain. In this position paper we argue that the community needs to act quickly in deciding what possible opportunities can and should be leveraged and how, while also working on overcoming otherwise mitigating the possible challenges. Assuming that the effectiveness and proliferation of these tools will continue to progress rapidly, without quick, deliberate, and concerted efforts, educators will lose advantage in helping shape what opportunities come to be, and what challenges will endure. With this paper we aim to seed this discussion within the computing education community.",,,,,"Luxton-Reilly, Andrew/ABC-5342-2021","Luxton-Reilly, Andrew/0000-0001-8269-2909; Denny, Paul/0000-0002-5150-9806; Finnie-Ansley, James/0000-0002-4279-6284",,,,,,,,,,,,,,,978-1-4503-9431-4,,,,2023,,,,,,,500,506,,10.1145/3545945.3569759,http://dx.doi.org/10.1145/3545945.3569759,,,,,,,,,,,,,WOS:001117817800074,View Full Record in Web of Science
J,"Haindl, P; Weinberger, G",,,,"Haindl, Philipp; Weinberger, Gerald",,,Students’ Experiences of Using ChatGPT in an Undergraduate Programming Course,IEEE ACCESS,,,,,,,,,,,,"Increasing use of artificial intelligence tools in programming education calls for a deeper understanding of their effect on students' learning. This paper presents a study that investigates the experiences of part-time undergraduate students using ChatGPT in a five-week Java programming course. After each exercise, students provided feedback via anonymous surveys in which they rated different suitability aspects of ChatGPT. The majority viewed ChatGPT positively and suitable for learning programming concepts. However, its suitability for specific implementation tasks received mixed reviews. Students found it easy to adapt ChatGPT's generated code to the exercises' implementation tasks. The students primarily used it for acquiring background knowledge, learning syntax and programming concepts and suggesting suitable algorithms. Yet, some abstained from using it due to concerns to not garner sufficient programming proficiency, retrieving partially incorrect or misleading generated code, preferring an independent working style, or general skepticism about its benefits. Finally, in response to our findings, we also discuss three perspective directions for improving the suitability of LLM chatbots for students in programming education.",,,,,,"Haindl, Philipp/0000-0001-6075-5286",,,,,,,,,,,,,2169-3536,,,,,,2024,12,,,,,,43519,43529,,10.1109/ACCESS.2024.3380909,http://dx.doi.org/10.1109/ACCESS.2024.3380909,,,,,,,,,,,,,WOS:001193742900001,View Full Record in Web of Science
C,"Roest, L; Keuning, H; Jeuring, J",,,ACM,"Roest, Lianne; Keuning, Hieke; Jeuring, Johan",,,Next-Step Hint Generation for Introductory Programming Using Large Language Models,"PROCEEDINGS OF THE 26TH AUSTRALASIAN COMPUTING EDUCATION CONFERENCE, ACE 2024",,,,,26th Australasian Computing Education Conference (ACE),"JAN 29-FEB 02, 2024","Sydney, AUSTRALIA",,,,,"Large Language Models possess skills such as answering questions, writing essays or solving programming exercises. Since these models are easily accessible, researchers have investigated their capabilities and risks for programming education. This work explores how LLMs can contribute to programming education by supporting students with automated next-step hints. We investigate prompt practices that lead to effective next-step hints and use these insights to build our StAP-tutor. We evaluate this tutor by conducting an experiment with students, and performing expert assessments. Our findings show that most LLM-generated feedback messages describe one specific next step and are personalised to the student ' s code and approach. However, the hints may contain misleading information and lack sufficient detail when students approach the end of the assignment. This work demonstrates the potential for LLM-generated feedback, but further research is required to explore its practical implementation.",,,,,,"Keuning, Hieke/0000-0001-5778-7519",,,,,,,,,,,,,,,979-8-4007-1619-5,,,,2024,,,,,,,144,153,,10.1145/3636243.3636259,http://dx.doi.org/10.1145/3636243.3636259,,,,,,,,,,,,,WOS:001166861800016,View Full Record in Web of Science
C,"Doughty, J; Wan, ZPA; Bompelli, A; Qayum, J; Wang, TZ; Zhang, JR; Zheng, YJ; Doyle, A; Sridhar, P; Agarwal, A; Bogart, C; Keylor, E; Kultur, C; Savelka, J; Sakr, M",,,ACM,"Doughty, Jacob; Wan, Zipiao; Bompelli, Anishka; Qayum, Jubahed; Wang, Taozhi; Zhang, Juran; Zheng, Yujia; Doyle, Aidan; Sridhar, Pragnya; Agarwal, Arav; Bogart, Christopher; Keylor, Eric; Kultur, Can; Savelka, Jaromir; Sakr, Majd",,,A Comparative Study of AI-Generated (GPT-4) and Human-crafted MCQs in Programming Education,"PROCEEDINGS OF THE 26TH AUSTRALASIAN COMPUTING EDUCATION CONFERENCE, ACE 2024",,,,,26th Australasian Computing Education Conference (ACE),"JAN 29-FEB 02, 2024","Sydney, AUSTRALIA",,,,,"There is a constant need for educators to develop and maintain effective up-to-date assessments. While there is a growing body of research in computing education on utilizing large language models (LLMs) in generation and engagement with coding exercises, the use of LLMs for generating programming MCQs has not been extensively explored. We analyzed the capability of GPT-4 to produce multiple-choice questions (MCQs) aligned with specific learning objectives (LOs) from Python programming classes in higher education. Specifically, we developed an LLM-powered (GPT-4) system for generation of MCQs from high-level course context and module-level LOs. We evaluated 651 LLM-generated and 449 human-crafted MCQs aligned to 246 LOs from 6 Python courses. We found that GPT-4 was capable of producing MCQs with clear language, a single correct choice, and high-quality distractors. We also observed that the generated MCQs appeared to be wellaligned with the LOs. Our findings can be leveraged by educators wishing to take advantage of the state-of-the-art generative models to support MCQ authoring efforts.",,,,,,"Bogart, Christopher/0000-0001-8581-115X; Savelka, Jaromir/0000-0002-3674-5456",,,,,,,,,,,,,,,979-8-4007-1619-5,,,,2024,,,,,,,114,123,,10.1145/3636243.3636256,http://dx.doi.org/10.1145/3636243.3636256,,,,,,,,,,,,,WOS:001166861800013,View Full Record in Web of Science
C,"Dean, M; Bond, RR; McTear, MF; Mulvenna, MD",,,IEEE,"Dean, Max; Bond, Raymond R.; McTear, Michael F.; Mulvenna, Maurice D.",,,ChatPapers: An AI Chatbot for Interacting with Academic Research,"2023 31ST IRISH CONFERENCE ON ARTIFICIAL INTELLIGENCE AND COGNITIVE SCIENCE, AICS",,,,,31st Irish Conference on Artificial Intelligence and Cognitive Science (AICS),"DEC 07-08, 2023","Letterkenny, IRELAND",,,,,"A growing and significant number of computer science related papers are being published; hence it is challenging to keep up with the latest research. This paper describes the development of a large language model (LLM) augmentation chatbot and user interface that provides responses to research queries in the domain of computer science. Around 200,000 computer science research papers from arXiv were embedded, resulting in similar to 11 million vectors (based on 'chunks' from the papers). Each vector is comprised of 384 numbers/dimensions. Technologies used include Langchain, a Vector Database, and Semantic Searching with document / query embeddings. The chatbot was tested using 30 sample questions that could be asked by computer science students across several topics and from different education levels (i.e., BSc, MSc and PhD level). The responses from this chatbot were compared with those from GPT-4. The responses with and without prompting were also compared. Readability metrics (Flesch-Kincaid and Coleman-Liau) were used to compare the responses from this LLM with GPT-4. Retrieval Augmented Generation Assessment (RAGAS), a novel LLM self-evaluation method was used to evaluate the system. We observed that the developed system provides more suitable responses to the user based on the readability level at which the questions were asked.",,,,,,,,,,,,,,,,,,,,,979-8-3503-6021-9,,,,2023,,,,,,,,,,10.1109/AICS60730.2023.10470521,http://dx.doi.org/10.1109/AICS60730.2023.10470521,,,,,,,,,,,,,WOS:001195949100008,View Full Record in Web of Science
C,"Dobslaw, F; Bergh, P",,,ACM,"Dobslaw, Felix; Bergh, Peter",,,Experiences with Remote Examination Formats in Light of GPT-4,"PROCEEDINGS OF THE 5TH EUROPEAN CONFERENCE ON SOFTWARE ENGINEERING EDUCATION, ECSEE 2023",,,,,5th European Conference on Software Engineering Education (ECSEE),"JUN 19-21, 2023","Seeon Monastery, GERMANY",,,,,"Sudden access to the rapidly improving large language model GPT by OpenAI forces educational institutions worldwide to revisit their exam procedures. In the pre-GPT era, we successfully applied oral and open-book home exams for two courses in the third year of our predominantly remote Software Engineering BSc program. We ask in this paper whether our current open-book exams are still viable or whether a move back to a legally compliant but less scalable oral exam is the only workable alternative. We further compare work-effort estimates between oral and open-book exams and report on differences in throughput and grade distribution over eight years to better understand the impact of examination format on the outcome. Examining GPT-4 on the most recent open-book exams showed that our current Artificial Intelligence and Reactive Programming exams are not GPT v4 proof. Three potential weaknesses of GPT are outlined. We also found that grade distributions have largely been unaffected by the examination format, opening up for a move to oral examinations only if needed. Throughput was higher for open-book exam course instances (73% vs 64%), while fail rates were too (12% vs 7%), with teacher workload increasing even for smaller classes. We also report on our experience regarding effort. Oral examinations are efficient for smaller groups but come with caveats regarding intensity and stress.",,,,,,"Dobslaw, Felix/0000-0001-9372-3416",,,,,,,,,,,,,,,978-1-4503-9956-2,,,,2023,,,,,,,220,225,,10.1145/3593663.3593695,http://dx.doi.org/10.1145/3593663.3593695,,,,,,,,,,,,,WOS:001124146500029,View Full Record in Web of Science
C,"Jordan, M; Ly, K; Raj, AGS",,,Assoc Computing Machinery,"Jordan, Mollie; Ly, Kevin; Raj, Adalbert Gerald Soosai",,,Need a Programming Exercise Generated in Your Native Language? ChatGPT's Got Your Back: Automatic Generation of Non-English Programming Exercises Using OpenAI GPT-3.5,"PROCEEDINGS OF THE 55TH ACM TECHNICAL SYMPOSIUM ON COMPUTER SCIENCE EDUCATION, SIGCSE 2024, VOL. 1",,,,,55th ACM Technical Symposium on Computer Science Education (SIGCSE),"MAR 20-23, 2024","Portland, OR","Assoc Comp Machinery,ACM Special Interest Grp Comp Sci Educ",,,,"Large language models (LLMs) like ChatGPT are changing computing education and may create additional barriers to those already faced by non-native English speakers (NNES) learning computing. We investigate an opportunity for a positive impact of LLMs on NNES through multilingual programming exercise generation. Following previous work with LLM exercise generation in English, we prompt OpenAI GPT-3.5 in 4 natural languages (English, Tamil, Spanish, and Vietnamese) to create introductory programming problems, sample solutions, and test cases. We evaluate these problems on their sensibility, readability, translation, sample solution accuracy, topicality, and cultural relevance. We find that problems generated in English, Spanish, and Vietnamese are largely sensible, easily understood, and accurate in their sample solutions. However, Tamil problems are mostly non-sensible and have a much lower passing test rate, indicating that the abilities of LLMs for problem generation are not generalizable across languages. Our analysis suggests that these problems could not be given verbatim to students, but with minimal effort, most errors can be fixed. We further discuss the benefits of these problems despite their flaws, and their opportunities to provide personalized and culturally relevant resources for students in their native languages.",,,,,,"Soosai Raj, Adalbert Gerald/0000-0002-6848-2208",,,,,,,,,,,,,,,979-8-4007-0423-9,,,,2024,,,,,,,618,624,,10.1145/3626252.3630897,http://dx.doi.org/10.1145/3626252.3630897,,,,,,,,,,,,,WOS:001181240800091,View Full Record in Web of Science
C,"Taylor, A; Vassar, A; Renzella, J; Pearce, H",,,Assoc Computing Machinery,"Taylor, Andrew; Vassar, Alexandra; Renzella, Jake; Pearce, Hammond",,,dcc --help: Transforming the Role of the Compiler by Generating Context-Aware Error Explanations with Large Language Models,"PROCEEDINGS OF THE 55TH ACM TECHNICAL SYMPOSIUM ON COMPUTER SCIENCE EDUCATION, SIGCSE 2024, VOL. 1",,,,,55th ACM Technical Symposium on Computer Science Education (SIGCSE),"MAR 20-23, 2024","Portland, OR","Assoc Comp Machinery,ACM Special Interest Grp Comp Sci Educ",,,,"In the challenging field of introductory programming, high enrolments and failure rates drive us to explore tools and systems to enhance student outcomes, especially automated tools that scale to large cohorts. This paper presents and evaluates the dcc --help tool, an integration of a Large Language Model (LLM) into the Debugging C Compiler (DCC) to generate unique, novice-focused explanations tailored to each error. dcc --help prompts an LLM with contextual information of compile- and run-time error occurrences, including the source code, error location and standard compiler error message. The LLM is instructed to generate novice-focused, actionable error explanations and guidance, designed to help students understand and resolve problems without providing solutions. dcc --help was deployed to our CS1 and CS2 courses, with 2,565 students using the tool over 64,000 times in ten weeks. We analysed a subset of these error/explanation pairs to evaluate their properties, including conceptual correctness, relevancy, and overall quality. We found that the LLM-generated explanations were conceptually accurate in 90% of compile-time and 75% of run-time cases, but often disregarded the instruction not to provide solutions in code. Our findings, observations and reflections following deployment indicate that dcc --help provides novel opportunities for scaffolding students' introduction to programming.",,,,,,"Renzella, Jake/0000-0002-9587-1196; Pearce, Hammond/0000-0002-3488-7004; Vassar, Sasha/0000-0001-8856-2566",,,,,,,,,,,,,,,979-8-4007-0423-9,,,,2024,,,,,,,1314,1320,,10.1145/3626252.3630822,http://dx.doi.org/10.1145/3626252.3630822,,,,,,,,,,,,,WOS:001181240800190,View Full Record in Web of Science
C,"Hoq, M; Shi, Y; Leinonen, J; Babalola, D; Lynch, C; Price, T; Akram, B",,,Assoc Computing Machinery,"Hoq, Muntasir; Shi, Yang; Leinonen, Juho; Babalola, Damilola; Lynch, Collin; Price, Thomas; Akram, Bita",,,Detecting ChatGPT-Generated Code Submissions in a CS1 Course Using Machine Learning Models,"PROCEEDINGS OF THE 55TH ACM TECHNICAL SYMPOSIUM ON COMPUTER SCIENCE EDUCATION, SIGCSE 2024, VOL. 1",,,,,55th ACM Technical Symposium on Computer Science Education (SIGCSE),"MAR 20-23, 2024","Portland, OR","Assoc Comp Machinery,ACM Special Interest Grp Comp Sci Educ",,,,"The emergence of publicly accessible large language models (LLMs) such as ChatGPT poses unprecedented risks of new types of plagiarism and cheating where students use LLMs to solve exercises for them. Detecting this behavior will be a necessary component in introductory computer science (CS1) courses, and educators should be well-equipped with detection tools when the need arises. However, ChatGPT generates code non-deterministically, and thus, traditional similarity detectors might not suffice to detect AI-created code. In this work, we explore the affordances of Machine Learning (ML) models for the detection task. We used an openly available dataset of student programs for CS1 assignments and had ChatGPT generate code for the same assignments, and then evaluated the performance of both traditional machine learning models and Abstract Syntax Tree-based (AST-based) deep learning models in detecting ChatGPT code from student code submissions. Our results suggest that both traditional machine learning models and AST-based deep learning models are effective in identifying ChatGPT-generated code with accuracy above 90%. Since the deployment of such models requires ML knowledge and resources that are not always accessible to instructors, we also explore the patterns detected by deep learning models that indicate possible ChatGPT code signatures, which instructors could possibly use to detect LLM-based cheating manually. We also explore whether explicitly asking ChatGPT to impersonate a novice programmer affects the code produced. We further discuss the potential applications of our proposed models for enhancing introductory computer science instruction.",,,,,"Leinonen, Juho/D-2162-2018","Leinonen, Juho/0000-0001-6829-9449; Price, Thomas/0000-0001-9375-2292; Shi, Yang/0000-0001-6486-4340",,,,,,,,,,,,,,,979-8-4007-0423-9,,,,2024,,,,,,,526,532,,10.1145/3626252.3630826,http://dx.doi.org/10.1145/3626252.3630826,,,,,,,,,,,,,WOS:001181240800078,View Full Record in Web of Science
C,"Savelka, J; Agarwal, A; An, M; Bogart, C; Sakr, M",,,ACM,"Savelka, Jaromir; Agarwal, Arav; An, Marshall; Bogart, Chris; Sakr, Majd",,,Thrilled by Your Progress! Large Language Models (GPT-4) No Longer Struggle to Pass Assessments in Higher Education Programming Courses,"PROCEEDINGS OF THE 2023 ACM CONFERENCE ON INTERNATIONAL COMPUTING EDUCATION RESEARCH V.1, ICER 2023 V1",,,,,19th Annual ACM Conference on International Computing Education Research V.1 (ICER),"AUG 07-11, 2023","Chicago, IL","Assoc Comp Machinery,ACM Special Interest Grp Comp Sci Educ",,,,"This paper studies recent developments in large language models' (LLM) abilities to pass assessments in introductory and intermediate Python programming courses at the postsecondary level. The emergence of ChatGPT resulted in heated debates of its potential uses (e.g., exercise generation, code explanation) as well as misuses in programming classes (e.g., cheating). Recent studies show that while the technology performs surprisingly well on diverse sets of assessment instruments employed in typical programming classes the performance is usually not sufficient to pass the courses. The release of GPT-4 largely emphasized notable improvements in the capabilities related to handling assessments originally designed for human test-takers. This study is the necessary analysis in the context of this ongoing transition towards mature generative AI systems. Specifically, we report the performance of GPT-4, comparing it to the previous generations of GPT models, on three Python courses with assessments ranging from simple multiple-choice questions (no code involved) to complex programming projects with code bases distributed into multiple files (599 exercises overall). Additionally, we analyze the assessments that were not handled well by GPT-4 to understand the current limitations of the model, as well as its capabilities to leverage feedback provided by an auto-grader. We found that the GPT models evolved from completely failing the typical programming class' assessments (the original GPT-3) to confidently passing the courses with no human involvement (GPT-4). While we identified certain limitations in GPT-4's handling of MCQs and coding exercises, the rate of improvement across the recent generations of GPT models strongly suggests their potential to handle almost any type of assessment widely used in higher education programming courses. These findings could be leveraged by educators and institutions to adapt the design of programming assessments as well as to fuel the necessary discussions into how programming classes should be updated to reflect the recent technological developments. This study provides evidence that programming instructors need to prepare for a world in which there is an easy-to-use widely accessible technology that can be utilized by learners to collect passing scores, with no effort whatsoever, on what today counts as viable programming knowledge and skills assessments.",,,,,,"Sakr, Majd/0000-0001-5150-8259; Bogart, Christopher/0000-0001-8581-115X; Agarwal, Arav/0000-0001-9848-1663; An, Haokang/0009-0005-5165-640X; Savelka, Jaromir/0000-0002-3674-5456",,,,,,,,,,,,,,,978-1-4503-9976-0,,,,2023,,,,,,,78,92,,10.1145/3568813.3600142,http://dx.doi.org/10.1145/3568813.3600142,,,,,,,,,,,,,WOS:001141973500006,View Full Record in Web of Science
J,"Wan, H; Luo, HZ; Li, MY; Luo, XY",,,,"Wan, Han; Luo, Hongzhen; Li, Mengying; Luo, Xiaoyan",,,Automated Program Repair for Introductory Programming Assignments,IEEE TRANSACTIONS ON LEARNING TECHNOLOGIES,,,,,,,,,,,,"Automatic program repair (APR) tools are valuable for students to assist them with debugging tasks since program repair captures the code modification to make a buggy program pass the given test-suite. However, the process of manually generating catalogs of code modifications is intricate and time-consuming. This article proposes contextual error model repair (CEMR), an automated program repair tool for introductory programming assignments. CEMR is designed to learn program code modifications from incorrect-correct code pairs automatically. Then, it utilizes these code modifications along with CodeBERT, a generative AI, to repair students' new incorrect programs in the same programming assignment. CEMR builds on the observation that code edits performed by students in pairs of incorrect-correct code can be used as input-output examples for learning code modifications. The key idea of CEMR is to leverage the wisdom of the crowd: it uses the existing code modifications of incorrect-correct student code pairs to repair the new incorrect student attempts. We chose three of the most related APR tools, Refazer, Refactory, and AlphaRepair, as the baselines to compare against CEMR. The experimental results demonstrate that, on public and real classroom datasets, CEMR achieves higher repair rates than the baselines. Through further analysis, CEMR has demonstrated promising effectiveness in addressing semantical and logical errors while its performance in fixing syntactical errors is limited. In terms of time for repairing buggy programs, CEMR costs approximately half as much as AlphaRepair requires. We opine that CEMR not only be seen as a program repair method that achieves good results with incorrect-correct code pairs but also be further utilized to generate hints to better assist students in learning programming.",,,,,,,,,,,,,,,,,,,1939-1382,,,,,,2024,17,,,,,,1745,1760,,10.1109/TLT.2024.3403710,http://dx.doi.org/10.1109/TLT.2024.3403710,,,,,,,,,,,,,WOS:001247287100003,View Full Record in Web of Science
