C,"Denny, P; Leinonen, J; Prather, J; Luxton-Reilly, A; Amarouche, T; Becker, BA; Reeves, BN",,,Assoc Computing Machinery,"Denny, Paul; Leinonen, Juho; Prather, James; Luxton-Reilly, Andrew; Amarouche, Thezyrie; Becker, Brett A.; Reeves, Brent N.",,,Prompt Problems: A New Programming Exercise for the Generative AI Era,"PROCEEDINGS OF THE 55TH ACM TECHNICAL SYMPOSIUM ON COMPUTER SCIENCE EDUCATION, SIGCSE 2024, VOL. 1",,,,,55th ACM Technical Symposium on Computer Science Education (SIGCSE),"MAR 20-23, 2024","Portland, OR","Assoc Comp Machinery,ACM Special Interest Grp Comp Sci Educ",,,,"Large language models (LLMs) are revolutionizing the field of computing education with their powerful code-generating capabilities. Traditional pedagogical practices have focused on code writing tasks, but there is now a shift in importance towards reading, comprehending and evaluating LLM-generated code. Alongside this shift, an important new skill is emerging - the ability to solve programming tasks by constructing good prompts for code-generating models. In this work we introduce a new type of programming exercise to hone this nascent skill: 'Prompt Problems'. Prompt Problems are designed to help students learn how to write effective prompts for AI code generators. A student solves a Prompt Problem by crafting a natural language prompt which, when provided as input to an LLM, outputs code that successfully solves a specified programming task. We also present a new web-based tool called Promptly which hosts a repository of Prompt Problems and supports the automated evaluation of prompt-generated code. We deploy Promptly in one CS1 and one CS2 course and describe our experiences, which include student perceptions of this new type of activity and their interactions with the tool. We find that students are enthusiastic about Prompt Problems, and appreciate how the problems engage their computational thinking skills and expose them to new programming constructs. We discuss ideas for the future development of new variations of Prompt Problems, and the need to carefully study their integration into classroom practice.",,,,,"Leinonen, Juho/D-2162-2018","Leinonen, Juho/0000-0001-6829-9449; Prather, James/0000-0003-2807-6042; Reeves, Brent/0000-0001-5781-1136",,,,,,,,,,,,,,,979-8-4007-0423-9,,,,2024,,,,,,,296,302,,10.1145/3626252.3630909,http://dx.doi.org/10.1145/3626252.3630909,,,,,,,,,,,,,WOS:001181240800045,View Full Record in Web of Science
C,"Prasad, P; Sane, A",,,Assoc Computing Machinery,"Prasad, Prajish; Sane, Aamod",,,A Self-Regulated Learning Framework using Generative AI and its Application in CS Educational Intervention Design,"PROCEEDINGS OF THE 55TH ACM TECHNICAL SYMPOSIUM ON COMPUTER SCIENCE EDUCATION, SIGCSE 2024, VOL. 1",,,,,55th ACM Technical Symposium on Computer Science Education (SIGCSE),"MAR 20-23, 2024","Portland, OR","Assoc Comp Machinery,ACM Special Interest Grp Comp Sci Educ",,,,"Self-regulation refers to the ability to plan, monitor, control and reflect on one's problem-solving process. Prior research has shown that self-regulated learning (SRL) strategies help improve novice performance in solving programming problems. However, with the advent of LLM tools like ChatGPT, novices can generate fairly accurate code by just providing the problem prompt, and hence may forego applying essential self-regulation strategies such as planning and reflection to solve the problem. In this position paper, we discuss challenges and opportunities that generative AI technologies pose for novices' self-regulation strategies in the context of programming problem solving. We believe that the key challenge facing educators is that such technologies may hamper novices' ability to regulate their programming problem solving process. On the other hand, these technologies also open up the possibility to design new interventions that promote better SRL strategies in learners. We draw on generic and domain-specific self-regulated learning theories as the basis of our work, and propose an SRL framework that incorporates use of generative AI tools in programming problem solving. We illustrate how the proposed framework guides exploration of the design space of interventions that integrate generative AI in CS education.",,,,,,"Prasad, Prajish/0000-0001-7986-6277",,,,,,,,,,,,,,,979-8-4007-0423-9,,,,2024,,,,,,,1070,1076,,10.1145/3626252.3630828,http://dx.doi.org/10.1145/3626252.3630828,,,,,,,,,,,,,WOS:001181240800155,View Full Record in Web of Science
C,"Pankiewicz, M; Baker, RS",,"Shih, JL; Kashihara, A; Chen, W; Ogata, H",,"Pankiewicz, Maciej; Baker, Ryan S.",,,Large Language Models (GPT) for automating feedback on programming assignments,"31ST INTERNATIONAL CONFERENCE ON COMPUTERS IN EDUCATION, ICCE 2023, VOL I",,,,,31st International Conference on Computers in Education (ICCE),"DEC 04-08, 2023","Kyoto Univ, Matsue, JAPAN","Learning & Educ Technologies Res Unit,Res Council Evidence Driven Educ,Asia Pacific Soc Comp Educ,Uchida Yoko Co Ltd,Photron Ltd",Kyoto Univ,,,"Addressing the challenge of generating personalized feedback for programming assignments is demanding due to several factors, like the complexity of code syntax or different ways to correctly solve a task. In this experimental study, we automated the process of feedback generation by employing OpenAI's GPT-3.5 model to generate personalized hints for students solving programming assignments on an automated assessment platform. Students rated the usefulness of GPT-generated hints positively. The experimental group (with GPT hints enabled) relied less on the platform's regular feedback but performed better in terms of percentage of successful submissions across consecutive attempts for tasks, where GPT hints were enabled. For tasks where the GPT feedback was made unavailable, the experimental group needed significantly less time to solve assignments. Furthermore, when GPT hints were unavailable, students in the experimental condition were initially less likely to solve the assignment correctly. This suggests potential over-reliance on GPT-generated feedback. However, students in the experimental condition were able to correct reasonably rapidly, reaching the same percentage correct after seven submission attempts. The availability of GPT hints did not significantly impact students' affective state.",,,,,"Pankiewicz, Maciej/JAN-8763-2023","Pankiewicz, Maciej/0000-0002-6945-0523",,,,,,,,,,,,,,,978-626-968-901-9,,,,2023,,,,,,,68,77,,,,,,,,,,,,,,,,WOS:001195903400010,View Full Record in Web of Science
C,"Prather, J; Denny, P; Leinonen, J; Becker, BA; Albluwi, I; Craig, M; Keuning, H; Kiesler, N; Kohn, T; Luxton-Reilly, A; MacNeil, S; Petersen, A; Pettit, R; Reeves, BN; Savelka, J",,,ACM,"Prather, James; Denny, Paul; Leinonen, Juho; Becker, Brett A.; Albluwi, Ibrahim; Craig, Michelle; Keuning, Hieke; Kiesler, Natalie; Kohn, Tobias; Luxton-Reilly, Andrew; MacNeil, Stephen; Petersen, Andrew; Pettit, Raymond; Reeves, Brent N.; Savelka, Jaromir",,,The Robots are Here: Navigating the Generative AI Revolution in Computing Education,"PROCEEDINGS OF THE 2023 WORKING GROUP REPORTS ON INNOVATION AND TECHNOLOGY IN COMPUTER SCIENCE EDUCATION, ITICSE-WGR 2023",,,,,28th Annual Conference on Working Group Reports on Innovation and Technology in Computer Science Education (ITiCSE-WGR),"JUL 07-12, 2023","Univ Turku, Turku, FINLAND","Assoc Comp Machinery,ACM Special Interest Grp Comp Sci Educ",Univ Turku,,,"Recent advancements in artificial intelligence (AI) and specifically generative AI (GenAI) are threatening to fundamentally reshape computing and society. Largely driven by large language models (LLMs), many tools are now able to interpret and generate both natural language instructions and source code. These capabilities have sparked urgent questions in the computing education community around how educators should adapt their pedagogy to address the challenges and to leverage the opportunities presented by this new technology. In this working group report, we undertake a comprehensive exploration of generative AI in the context of computing education and make five significant contributions. First, we provide a detailed review of the literature on LLMs in computing education and synthesise findings from 71 primary articles, nearly 80% of which have been published in the first 8 months of 2023. Second, we report the findings of a survey of computing students and instructors from across 20 countries, capturing prevailing attitudes towards GenAI/LLMs and their use in computing education contexts. Third, to understand how pedagogy is already changing, we offer insights collected from in-depth interviews with 22 computing educators from five continents. Fourth, we use the ACM Code of Ethics to frame a discussion of ethical issues raised by the use of large language models in computing education, and we provide concrete advice for policy makers, educators, and students. Finally, we benchmark the performance of several current GenAI models/tools on various computing education datasets, and highlight the extent to which the capabilities of current models are rapidly improving. There is little doubt that LLMs and other forms of GenAI will have a profound impact on computing education over the coming years. However, just as the technology will continue to improve, so will our collective knowledge about how to leverage these new models and tools in educational settings. We expect many important conversations around this topic will emerge as the community explores how to provide more effective, inclusive, and personalised learning experiences. Our aim is that this report will serve as a focal point for both researchers and practitioners who are exploring, adapting, using, and evaluating GenAI and LLM-based tools in computing classrooms.",,,,,"Luxton-Reilly, Andrew/ABC-5342-2021; Savelka, Jaromir/GOK-0488-2022; Leinonen, Juho/D-2162-2018; MacNeil, Stephen/HPH-0843-2023; Craig, Michelle/HOF-9433-2023","Luxton-Reilly, Andrew/0000-0001-8269-2909; Savelka, Jaromir/0000-0002-3674-5456; Leinonen, Juho/0000-0001-6829-9449; MacNeil, Stephen/0000-0003-2781-6619; Craig, Michelle/0000-0001-8283-0072; Kiesler, Natalie/0000-0002-6843-2729; Keuning, Hieke/0000-0001-5778-7519; Kohn, Tobias/0000-0002-9251-8944; Prather, James/0000-0003-2807-6042",,,,,,,,,,,,,,,979-8-4007-0405-5,,,,2023,,,,,,,,,108,10.1145/3623762.3633499,http://dx.doi.org/10.1145/3623762.3633499,,,,,,,,,,,,,WOS:001167053500004,View Full Record in Web of Science
J,"Kim, D; Kim, T; Kim, Y; Byun, YH; Yun, TS",,,,"Kim, Daehyun; Kim, Taegu; Kim, Yejin; Byun, Yong-Hoon; Yun, Tae Sup",,,A ChatGPT-MATLAB framework for numerical modeling in geotechnical engineering applications,COMPUTERS AND GEOTECHNICS,,,,,,,,,,,,"ChatGPT has recently emerged as a representative of Large Language Models (LLMs) that have brought evolutionary changes to our society, and the effectiveness of ChatGPT in various applications has been increasingly reported. This study aimed to explore the potential of employing programming performance driven by ChatGPT responses to conversational prompts in the field of geotechnical engineering. The tested examples included the analysis of seepage flow and slope stability, and the image processing of X-ray computed tomographic image for partially saturated sand. For each case, the prompt was initially fed by a narrative explanation of the problem attributes such as geometry, initial conditions, and boundary conditions to generate the MATLAB code that was in turn executed to evaluate the correctness and functionality. Any errors and unanticipated results were further refined by additional prompts until the correct outcome was achieved. ChatGPT was able to generate the numerical code at a considerable level, demonstrating creditable awareness of the refining process, when meticulous prompts were provided based on a comprehensive understanding of given problems. While ChatGPT may not be able to replace the entire process of programming, it can help minimize sloppy syntax errors and assist in designing a basic framework for logical programming.",,,,,,"Kim, Daehyun/0000-0002-5277-0862",,,,,,,,,,,,,0266-352X,1873-7633,,,,MAY,2024,169,,,,,,,,106237,10.1016/j.compgeo.2024.106237,http://dx.doi.org/10.1016/j.compgeo.2024.106237,,MAR 2024,,,,,,,,,,,WOS:001219361200001,View Full Record in Web of Science
C,"Ta, NBD; Nguyen, HGP; Gottipati, S",,"Shih, JL; Kashihara, A; Chen, W; Ogata, H",,"Ta, Nguyen Binh Duong; Nguyen, Hua Gia Phuc; Gottipati, Swapna",,,ExGen: Ready-To-Use Exercise Generation in Introductory Programming Courses,"31ST INTERNATIONAL CONFERENCE ON COMPUTERS IN EDUCATION, ICCE 2023, VOL I",,,,,31st International Conference on Computers in Education (ICCE),"DEC 04-08, 2023","Kyoto Univ, Matsue, JAPAN","Learning & Educ Technologies Res Unit,Res Council Evidence Driven Educ,Asia Pacific Soc Comp Educ,Uchida Yoko Co Ltd,Photron Ltd",Kyoto Univ,,,"In introductory programming courses, students as novice programmers would benefit from doing frequent practices set at a difficulty level and concept suitable for their skills and knowledge. However, setting many good programming exercises for individual learners is very time-consuming for instructors. In this work, we propose an automated exercise generation system, named ExGen, which leverages recent advances in pre-trained large language models (LLMs) to automatically create customized and ready-to-use programming exercises for individual students on-demand. The system integrates seamlessly with Visual Studio Code, a popular development environment for computing students and software engineers. ExGen effectively does the following: 1) maintaining a set of seed exercises in a personalized database stored locally for each student; 2) constructing appropriate prompts from the seed exercises to be sent to a cloud-based LLM deployment for generating candidate exercises; and 3) implementing a novel combination of filtering checks to automatically select only ready-to-use exercises for a student to work on. Extensive evaluation using more than 600 Python exercises demonstrates the effectiveness of ExGen in generating customized, ready-to-use programming exercises for new computing students.",,,,,,,,,,,,,,,,,,,,,978-626-968-901-9,,,,2023,,,,,,,104,113,,,,,,,,,,,,,,,,WOS:001195903400015,View Full Record in Web of Science
C,"Laato, S; Morschheuser, B; Hamari, J; Björne, J",,"Chang, M; Chen, NS; Kuo, R; Rudolph, G; Sampson, DG; Tlili, A",,"Laato, Samuli; Morschheuser, Benedikt; Hamari, Juho; Bjorne, Jari",,,AI-assisted Learning with ChatGPT and Large Language Models: Implications for Higher Education,"2023 IEEE INTERNATIONAL CONFERENCE ON ADVANCED LEARNING TECHNOLOGIES, ICALT",IEEE International Conference on Advanced Learning Technologies,,,,23rd IEEE International Conference on Advanced Learning Technologies (ICALT),"JUL 10-13, 2023","Orem, UT","IEEE,IEEE Comp Soc,IEEE Tech Community Learning Technol",,,,"The recent progress in generative AI models, particularly large language models (LLMs), has brought about a transformation in the field of education. Conversational LLM services, such as Google's Bard and OpenAI's ChatGPT, offer students access to many abilities such as summarization and generation of text and code, and on-demand replies to questions on expert topics. In this paper, we observe ChatGPT to explore how LLM services impact learning and instruction in higher education. First, we mapped the capabilities of the system by reviewing the grey literature on ChatGPT and using the system ourselves for two months. Second, we selected a Bachelor level computer science curriculum from a Finnish university, and examined the impact of ChatGPT on the offered courses. As an outcome of this study, we highlight 13 implications for students' learning in higher education, and discuss the contemporary future of AI-assisted learning in universities and beyond.",,,,,,"Laato, Samuli/0000-0003-4285-0073; Morschheuser, Benedikt/0000-0002-7665-8971",,,,,,,,,,,,,2161-3761,,979-8-3503-0054-3,,,,2023,,,,,,,226,230,,10.1109/ICALT58122.2023.00072,http://dx.doi.org/10.1109/ICALT58122.2023.00072,,,,,,,,,,,,,WOS:001094548800066,View Full Record in Web of Science
C,"Singh, D; Nishane, I; Rajendran, R",,"Shih, JL; Kashihara, A; Chen, W; Ogata, H",,"Singh, Daevesh; Nishane, Indrayani; Rajendran, Ramkumar",,,Catalyzing Python Learning: Assessing an LLM-based Conversational Agent,"31ST INTERNATIONAL CONFERENCE ON COMPUTERS IN EDUCATION, ICCE 2023, VOL II",,,,,31st International Conference on Computers in Education (ICCE),"DEC 04-08, 2023","Kyoto Univ, Matsue, JAPAN","Learning & Educ Technologies Res Unit,Res Council Evidence Driven Educ,Asia Pacific Soc Comp Educ,Uchida Yoko Co Ltd,Photron Ltd",Kyoto Univ,,,"The rapid rise of digital learning platforms has ushered in an era of educational transformation. While these platforms offer the advantage of scalability, they often fall short in facilitating meaningful interaction, which is pivotal for effective learning. Addressing this concern, our study introduces PyGuru 2.0, an innovative online learning environment for Python programming that aligns with the ICAP framework with an advanced conversational agent. We further investigate the interactions between students and a chatbot, employing a qualitative approach to comprehensively explore the diverse ways in which students interact with the chatbot. The interaction categories encompass a wide spectrum, including code assistance, error resolution, and conceptual explanation. In future, we plan to further elaborate on this coding scheme and see its impact on students' learning outcomes.",,,,,,,,,,,,,,,,,,,,,978-626-968-902-6,,,,2023,,,,,,,932,934,,,,,,,,,,,,,,,,WOS:001191920400138,View Full Record in Web of Science
J,"Azaiz, I; Deckarm, O; Strickroth, S",,,,"Azaiz, Imen; Deckarm, Oliver; Strickroth, Sven",,,AI-Enhanced Auto-Correction of Programming Exercises: How Effective is GPT-3.5?,INTERNATIONAL JOURNAL OF ENGINEERING PEDAGOGY,,,,,,,,,,,,"Timely formative feedback is considered as one of the most important drivers for effective learning. Delivering timely and individualized feedback is particularly challenging in large classes in higher education. Recently Large Language Models such as GPT-3 became available to the public that showed promising results on various tasks such as code generation and code explanation. This paper investigates the potential of AI in providing personalized code correction and generating feedback. Based on existing student submissions of two different real-world assignments, the correctness of the AI-aided e-assessment as well as the characteristics such as fault localization, correctness of hints, and code style suggestions of the generated feedback are investigated. The results show that 73% of the submissions were correctly identified as either correct or incorrect. In 59% of these cases, GPT-3.5 also successfully generated effective and high-quality feedback. Additionally, GPT-3.5 exhibited weaknesses in its evaluation, including localization of errors that were not the actual errors, or even hallucinated errors. Implications and potential new usage scenarios are discussed.",,,,,,"Strickroth, Sven/0000-0002-9647-300X; Azaiz, Imen/0009-0005-6458-4169; Deckarm, Oliver/0009-0008-2919-4044",,,,,,,,,,,,,2192-4880,,,,,,2023,13,8,,,,,67,83,,10.3991/ijep.v13i8.45621,http://dx.doi.org/10.3991/ijep.v13i8.45621,,,,,,,,,,,,,WOS:001126694600008,View Full Record in Web of Science
C,"Sarsa, S; Denny, P; Hellas, A; Leinonen, J",,,ACM,"Sarsa, Sami; Denny, Paul; Hellas, Arto; Leinonen, Juho",,,Automatic Generation of Programming Exercises and Code Explanations Using Large Language Models,"PROCEEDINGS OF THE 2022 ACM CONFERENCE ON INTERNATIONAL COMPUTING EDUCATION RESEARCH, ICER 2022, VOL. 1",,,,,18th Annual ACM Conference on International Computing Education Research (ICER),"AUG 07-11, 2022",ELECTR NETWORK,"Assoc Comp Machinery,ACM Special Interest Grp Comp Sci Educ",,,,"This article explores the natural language generation capabilities of large language models with application to the production of two types of learning resources common in programming courses. Using OpenAI Codex as the large language model, we create programming exercises (including sample solutions and test cases) and code explanations, assessing these qualitatively and quantitatively. Our results suggest that the majority of the automatically generated content is both novel and sensible, and in some cases ready to use as is. When creating exercises we find that it is remarkably easy to influence both the programming concepts and the contextual themes they contain, simply by supplying keywords as input to the model. Our analysis suggests that there is significant value in massive generative machine learning models as a tool for instructors, although there remains a need for some oversight to ensure the quality of the generated content before it is delivered to students. We further discuss the implications of OpenAI Codex and similar tools for introductory programming education and highlight future research streams that have the potential to improve the quality of the educational experience for both teachers and students alike.",,,,,"Leinonen, Juho/D-2162-2018","Leinonen, Juho/0000-0001-6829-9449",,,,,,,,,,,,,,,978-1-4503-9194-8,,,,2023,,,,,,,27,43,,,,,,,,,,,,,,,,WOS:001143762100004,View Full Record in Web of Science
C,"Prather, J; Denny, P; Leinonen, J; Becker, BA; Albluwi, I; Caspersen, ME; Craig, M; Keuning, H; Kiesler, N; Kohn, T; Luxton-Reilly, A; MacNeil, S; Petersen, A; Pettit, R; Reeves, BN; Savelka, J",,,ACM,"Prather, James; Denny, Paul; Leinonen, Juho; Becker, Brett A.; Albluwi, Ibrahim; Caspersen, Michael E.; Craig, Michelle; Keuning, Hieke; Kiesler, Natalie; Kohn, Tobias; Luxton-Reilly, Andrew; MacNeil, Stephen; Petersen, Andrew; Pettit, Raymond; Reeves, Brent N.; Savelka, Jaromir",,,Transformed by Transformers: Navigating the AI Coding Revolution for Computing Education An ITiCSE Working Group Conducted by Humans,"PROCEEDINGS OF THE 2023 CONFERENCE ON INNOVATION AND TECHNOLOGY IN COMPUTER SCIENCE EDUCATION, ITICSE 2023, VOL. 2",,,,,28th Annual Conference on Innovation and Technology in Computer Science Education (ITiCSE),"JUL 08-12, 2023","Univ Turku, Turku, FINLAND","Assoc Comp Machinery,ACM Special Interest Grp Comp Sci Educ,ACM Europe Council,Informat Europe",Univ Turku,,,"The recent advent of highly accurate and scalable large language models (LLMs) has taken the world by storm. From art to essays to computer code, LLMs are producing novel content that until recently was thought only humans could produce. Recent work in computing education has sought to understand the capabilities of LLMs for solving tasks such as writing code, explaining code, creating novel coding assignments, interpreting programming error messages, and more. However, these technologies continue to evolve at an astonishing rate leaving educators little time to adapt. This working group seeks to document the state-of-the-art for code generation LLMs, detail current opportunities and challenges related to their use, and present actionable approaches to integrating them into computing curricula.",,,,,"MacNeil, Stephen/HPH-0843-2023; Craig, Michelle/HOF-9433-2023; Leinonen, Juho/D-2162-2018; Luxton-Reilly, Andrew/ABC-5342-2021","MacNeil, Stephen/0000-0003-2781-6619; Craig, Michelle/0000-0001-8283-0072; Leinonen, Juho/0000-0001-6829-9449; Luxton-Reilly, Andrew/0000-0001-8269-2909; Kohn, Tobias/0000-0002-9251-8944; Kiesler, Natalie/0000-0002-6843-2729; Denny, Paul/0000-0002-5150-9806; Prather, James/0000-0003-2807-6042; Keuning, Hieke/0000-0001-5778-7519",,,,,,,,,,,,,,,979-8-4007-0139-9,,,,2023,,,,,,,561,562,,10.1145/3587103.3594206,http://dx.doi.org/10.1145/3587103.3594206,,,,,,,,,,,,,WOS:001054840400001,View Full Record in Web of Science
